{
  "packet_kind": "trial_balance",
  "book_id": "book-1",
  "as_of_date": "2026-02-28",
  "decimal_places": 2,
  "total_debits": "1200.00",
  "total_credits": "1200.00",
  "rows": [
    {
      "account_id": "acct-1",
      "account_number": "1000",
      "account_name": "Cash",
      "account_type": "asset",
      "debit": "1200.00",
      "credit": "0.00"
    },
    {
      "account_id": "acct-2",
      "account_number": "3000",
      "account_name": "Capital",
      "account_type": "equity",
      "debit": "0.00",
      "credit": "1000.00"
    },
    {
      "account_id": "acct-3",
      "account_number": "4000",
      "account_name": "Revenue",
      "account_type": "revenue",
      "debit": "0.00",
      "credit": "200.00"
    }
  ]
}
